### ISSUE TITLE
filebeat failing to connect to Elasticsearch using SSL

### ISSUE THREAD

**Issue by nellicus** [elastic/filebeat#287]
curl output
```
abonuccelli@w530 /opt/elk/PRODSEC/beats/filebeat/filebeat-1.0.0-rc2-x86_64 $ curl -u admin:r1ng3r -XGET https://w530:9202 --cacert /opt/elk/PRODSEC/FS/secure/cacert.pem 
{
  "name" : "node3",
  "cluster_name" : "tony_prod_sec",
  "version" : {
    "number" : "2.0.0",
    "build_hash" : "de54438d6af8f9340d50c5c786151783ce7d6be5",
    "build_timestamp" : "2015-10-22T08:09:48Z",
    "build_snapshot" : false,
    "lucene_version" : "5.2.1"
  },
  "tagline" : "You Know, for Search"
}
```

curl output 2

```
abonuccelli@w530 /opt/elk/PRODSEC/beats/filebeat/filebeat-1.0.0-rc2-x86_64 $ curl -u admin:r1ng3r -XHEAD https://w530:9203 --cacert /opt/elk/PRODSEC/FS/secure/cacert.pem 
curl: (7) Failed to connect to w530 port 9203: Connection refused
hangon
ignore ^^
abonuccelli@w530 /opt/elk/PRODSEC/beats/filebeat/filebeat-1.0.0-rc2-x86_64 $ curl -u admin:r1ng3r -XHEAD https://w530:9202 --cacert /opt/elk/PRODSEC/FS/secure/cacert.pem 
abonuccelli@w530 /opt/elk/PRODSEC/beats/filebeat/filebeat-1.0.0-rc2-x86_64 $ curl -u admin:r1ng3r -XHEAD https://w530:9202 --cacert /opt/elk/PRODSEC/FS/secure/cacert.pem  -v
* Rebuilt URL to: https://w530:9202/
* Hostname was NOT found in DNS cache
*   Trying 127.0.1.1...
* Connected to w530 (127.0.1.1) port 9202 (#0)
* successfully set certificate verify locations:
*   CAfile: /opt/elk/PRODSEC/FS/secure/cacert.pem
  CApath: /etc/ssl/certs
* SSLv3, TLS handshake, Client hello (1):
* SSLv3, TLS handshake, Server hello (2):
* SSLv3, TLS handshake, CERT (11):
* SSLv3, TLS han
dshake, Server key exchange (12):
* SSLv3, TLS handshake, Server finished (14):
* SSLv3, TLS handshake, Client key exchange (16):
* SSLv3, TLS change cipher, Client hello (1):
* SSLv3, TLS handshake, Finished (20):
* SSLv3, TLS change cipher, Client hello (1):
* SSLv3, TLS handshake, Finished (20):
* SSL connection using ECDHE-RSA-AES128-SHA
* Server certificate:
*        subject: CN=w530
*        start date: 2015-11-01 22:55:49 GMT
*        expire date: 2016-10-31 22:55:49 GMT
*        subjectAltName: w530 matched
*        issuer: CN="Elasticsearch Test RootCA"
*        SSL certificate verify ok.
* Server auth using Basic with user 'admin'
> HEAD / HTTP/1.1
> Authorization: Basic YWRtaW46cjFuZzNy
> User-Agent: curl/7.35.0
> Host: w530:9202
> Accept: */*
> 
< HTTP/1.1 200 OK
< Content-Type: text/plain; charset=UTF-8
< Content-Length: 0
< 
* Connection #0 to host w530 left intact
```

cacert 
```
abonuccelli@w530 /opt/elk/PRODSEC/beats/filebeat/filebeat-1.0.0-rc2-x86_64 $ keytool -printcert -v -file /opt/elk/PRODSEC/FS/secure/cacert.pem 
Owner: CN="Elasticsearch Test RootCA"
Issuer: CN="Elasticsearch Test RootCA"
Serial number: 9560e13f57abd61b
Valid from: Sun Nov 01 23:54:44 CET 2015 until: Mon Oct 31 23:54:44 CET 2016
Certificate fingerprints:
	 MD5:  4C:43:3A:3E:DB:3D:B3:65:79:32:39:98:04:51:5F:74
	 SHA1: 88:0D:4E:93:6C:8E:5C:6A:23:56:CD:8F:58:D6:EA:63:47:8E:86:69
	 SHA256: 56:FD:07:00:1C:55:AD:16:B4:E2:8C:35:5F:9F:6B:23:AD:7B:9F:ED:61:A5:07:9D:1A:80:B3:53:7A:77:53:C1
	 Signature algorithm name: SHA256withRSA
	 Version: 3

Extensions: 

#1: ObjectId: 2.5.29.35 Criticality=false
AuthorityKeyIdentifier [
KeyIdentifier [
0000: F6 74 D3 93 1B 3F 3D 63   E4 38 F4 84 1A 37 05 39  .t...?=c.8...7.9
0010: 10 26 03 52                                        .&.R
]
[CN="Elasticsearch Test RootCA"]
SerialNumber: [    9560e13f 57abd61b]
]

#2: ObjectId: 2.5.29.19 Criticality=false
BasicConstraints:[
  CA:true
  PathLen:2147483647
]

#3: ObjectId: 2.5.29.14 Criticality=false
SubjectKeyIdentifier [
KeyIdentifier [
0000: F6 74 D3 93 1B 3F 3D 63   E4 38 F4 84 1A 37 05 39  .t...?=c.8...7.9
0010: 10 26 03 52                                        .&.R
]
]
```

fb config 
```
output:

  ### Elasticsearch as output
  elasticsearch:
    # Array of hosts to connect to.
    # Scheme and port can be left out and will be set to the default (http and 9200)
    # In case you specify and additional path, the scheme is required: http://localhost:9200/path
    # IPv6 addresses should always be defined as: https://[2001:db8::1]:9200
    hosts: ["192.168.1.105:9202"]

    # Optional protocol and basic auth credentials. These are deprecated.
    protocol: "https"
    username: "admin"
    password: "r1ng3r"

    # Number of workers per Elasticsearch host.
    worker: 1

    # Optional index name. The default is "filebeat" and generates
    # [filebeat-]YYYY.MM.DD keys.
    index: "filebeat"

    # Optional HTTP Path
    #path: "/elasticsearch"

    # The number of times a particular Elasticsearch index operation is attempted. If
    # the indexing operation doesn't succeed after this many retries, the events are
    # dropped. The default is 3.
    #max_retries: 3

    # The maximum number of events to bulk in a single Elasticsearch bulk API index request.
    # The default is 50.
    #bulk_max_size: 50

    # Configure http request timeout before failing an request to Elasticsearch.
    #timeout: 90

    # The number of seconds to wait for new events between two bulk API index requests.
    # If `bulk_max_size` is reached before this interval expires, addition bulk index
    # requests are made.
    #flush_interval: 1

    # Boolean that sets if the topology is kept in Elasticsearch. The default is
    # false. This option makes sense only for Packetbeat.
    #save_topology: false

    # The time to live in seconds for the topology information that is stored in
    # Elasticsearch. The default is 15 seconds.
    #topology_expire: 15

    # tls configuration. By default is off.
    tls:
      # List of root certificates for HTTPS server verifications
      certificate_authorities: ["/opt/elk/PRODSEC/FS/secure/cacert.pem"]

      # Certificate for TLS client authentication
      #certificate: "/etc/pki/client/cert.pem"

      # Client Certificate Key
      #certificate_key: "/etc/pki/client/cert.key"

      # Controls whether the client verifies server certificates and host name.
      # If insecure is set to true, all server host names and certificates will be
      # accepted. In this mode TLS based connections are susceptible to
      # man-in-the-middle attacks. Use only for testing.
      insecure: true

      # Configure cipher suites to be used for TLS connections
      #cipher_suites: []

      # Configure curve types for ECDHE based cipher suites
      #curve_types: []

      # Configure minimum TLS version allowed for connection to logstash
      #min_version: 1.0

      # Configure maximum TLS version allowed for connection to logstash
      #max_version: 1.2
```

FB debug

```
abonuccelli@w530 /opt/elk/PRODSEC/beats/filebeat/filebeat-1.0.0-rc2-x86_64 $ ./filebeat -c filebeat.yml -e -d '*'
2015/11/24 11:54:56.318874 beat.go:97: DBG  Initializing output plugins
2015/11/24 11:54:56.318982 geolite.go:24: INFO GeoIP disabled: No paths were set under output.geoip.paths
2015/11/24 11:54:56.346434 outputs.go:111: INFO Activated elasticsearch as output plugin.
2015/11/24 11:54:56.346464 publish.go:198: DBG  create output worker: 0x0, 0xc8200dd260
2015/11/24 11:54:56.346497 publish.go:235: DBG  No output is defined to store the topology. The server fields might not be filled.
2015/11/24 11:54:56.346546 publish.go:249: INFO Publisher name: filebeat-w530
2015/11/24 11:54:56.346808 async.go:95: DBG  create bulk proces
sing worker (interval=1s, bulk size=50)
2015/11/24 11:54:56.346867 beat.go:107: INFO Init Beat: filebeat; Version: 1.0.0-rc2
2015/11/24 11:54:56.347544 beat.go:133: INFO filebeat sucessfully setup. Start running.
2015/11/24 11:54:56.347599 registrar.go:66: INFO Registry file set to: /opt/elk/PRODSEC/beats/filebeat/filebeat-1.0.0-rc2-x86_64/.filebeat
2015/11/24 11:54:56.347631 registrar.go:76: INFO Loading registrar data from /opt/elk/PRODSEC/beats/filebeat/filebeat-1.0.0-rc2-x86_64/.filebeat
2015/11/24 11:54:56.347694 spooler.go:44: DBG  Set idleTimeoutDuration to 5s
2015/11/24 11:54:56.347710 crawler.go:38: DBG  File Configs: [/var/log/auth.log]
2015/11/24 11:54:56.347726 prospector.go:127: DBG  Set ignore_older duration to 10m0s
2015/11/24 11:54:56.347738 prospector.go:127: DBG  Set scan_frequency duration to 10s
2015/11/24 11:54:56.347747 prospector.go:127: DBG  Set backoff duration to 1s
2015/11/24 11:54:56.347756 prospector.go:127: DBG  Set max_backoff duration to 10s
2015/11/24 11:54:56.347767 prospector.go:127: DBG  Set partial_line_waiting duration to 5s
2015/11/24 11:54:56.347777 crawler.go:58: DBG  Waiting for 1 prospectors to initialise
2015/11/24 11:54:56.347796 prospector.go:140: DBG  Harvest path: /var/log/auth.log
2015/11/24 11:54:56.347827 prospector.go:206: DBG  scan path /var/log/auth.log
2015/11/24 11:54:56.347848 prospector.go:218: DBG  Check file for harvesting: /var/log/auth.log
2015/11/24 11:54:56.347860 prospector.go:272: DBG  Start harvesting unknown file: /var/log/auth.log
2015/11/24 11:54:56.347877 prospector.go:318: DBG  Launching harvester on new file: /var/log/auth.log
2015/11/24 11:54:56.347891 prospector.go:206: DBG  scan path /var/log/auth.log
2015/11/24 11:54:56.347903 prospector.go:218: DBG  Check file for harvesting: /var/log/auth.log
2015/11/24 11:54:56.347914 prospector.go:336: DBG  Update existing file for harvesting: /var/log/auth.log
2015/11/24 11:54:56.347922 prospector.go:378: DBG  Not harvesting, file didn't change: /var/log/auth.log
2015/11/24 11:54:56.347936 crawler.go:77: INFO All prospectors initialised with 0 states to persist
2015/11/24 11:54:56.347965 registrar.go:83: INFO Starting Registrar
2015/11/24 11:54:56.347986 filebeat.go:122: INFO Start sending events to output
2015/11/24 11:54:56.348125 spooler.go:77: INFO Starting spooler: spool_size: 1024; idle_timeout: 5s
2015/11/24 11:54:56.348280 log.go:62: INFO Harvester started for file: /var/log/auth.log
2015/11/24 11:54:56.348305 log.go:165: DBG  harvest: "/var/log/auth.log" (offset snapshot:0)
2015/11/24 11:54:58.848368 spooler.go:97: DBG  Flushing spooler because of timemout. Events flushed: %!s(int=358)
2015/11/24 11:54:58.849538 client.go:55: DBG  send event
2015/11/24 11:54:58.849637 preprocess.go:37: DBG  Start Preprocessing
2015/11/24 11:54:58.849930 publish.go:100: DBG  Publish: {
  "@timestamp": "2015-11-24T11:54:56.348Z",
  "beat": {
    "hostname": "w530",
    "name": "filebeat-w530"

#MESSAGES PUBLISHED
  "message": "Nov 24 12:47:09 w530 sudo: pam_unix(sudo:session): session closed for user root",
  "offset": 35442,
  "source": "/var/log/auth.log",
  "type": "auth"
}
2015/11/24 11:54:59.078684 preprocess.go:94: DBG  Forward preprocessed events
2015/11/24 11:54:59.078740 output.go:103: DBG  output worker: publish 50 events
2015/11/24 11:54:59.079455 single.go:121: INFO Connecting error publishing events (retrying): not connected
2015/11/24 11:54:59.079475 single.go:143: INFO send fail
2015/11/24 11:54:59.079485 single.go:150: INFO backoff retry: 1s
2015/11/24 11:55:00.091788 single.go:121: INFO Connecting error publishing events (retrying): not connected
2015/11/24 11:55:
00.091833 single.go:143: INFO send fail
2015/11/24 11:55:00.091853 single.go:150: INFO backoff retry: 2s
2015/11/24 11:55:02.093368 single.go:121: INFO Connecting error publishing events (retrying): not connected
2015/11/24 11:55:02.093413 single.go:143: INFO send fail
2015/11/24 11:55:02.093431 single.go:150: INFO backoff retry: 4s
2015/11/24 11:55:06.095028 single.go:121: INFO Connecting error publishing events (retrying): not connected
2015/11/24 11:55:06.095989 single.go:121: INFO Connecting error publishing events (retrying): not connected
2015/11/24 11:55:06.096018 single.go:143: INFO send fail
2015/11/24 11:55:06.096035 single.go:150: INFO backoff retry: 1s
2015/11/24 11:55:06.348079 prospector.go:185: DBG  Start next scan
2015/11/24 11:55:06.348156 prospector.go:206: DBG  scan path /var/log/auth.log
2015/11/24 11:55:06.348159 spooler.go:97: DBG  Flushing spooler because of timemout. Events flushed: %!s(int=2)
2015/11/24 11:55:06.348201 prospector.go:218: DBG  Check file for harvesting: /var/log/auth.log
2015/11/24 11:55:06.348223 prospector.go:336: DBG  Update existing file for harvesting: /var/log/auth.log
2015/11/24 11:55:06.348239 prospector.go:378: DBG  Not harvesting, file didn't change: /var/log/auth.log
2015/11/24 11:55:07.097447 single.go:121: INFO Connecting error publishing events (retrying): not connected
2015/11/24 11:55:07.097489 single.go:143: INFO send fail
2015/11/24 11:55:07.097507 single.go:150: INFO backoff retry: 2s
2015/11/24 11:55:09.099146 single.go:121: INFO Connecting error publishing events (retrying): not connected
2015/11/24 11:55:09.099191 single.go:143: INFO send fail
2015/11/24 11:55:09.099219 single.go:150: INFO backoff retry: 4s
2015/11/24 11:55:13.100552 single.go:121: INFO Connecting error publishing events (retrying): not connected
2015/11/24 11:55:13.101323 single.go:121: INFO Connecting error publishing events (retrying): not connected
2015/11/24 11:55:13.101352 single.go:143: INFO send fail
2015/11/24 11:55:13.101370 single.go:150: INFO backoff retry: 1s
2015/11/24 11:55:13.848260 spooler.go:97: DBG  Flushing spooler because of timemout. Events flushed: %!s(int=0)
2015/11/24 11:55:14.102112 single.go:121: INFO Connecting error publishing events (retrying): not connected
2015/11/24 11:55:14.102134 single.go:143: INFO send fail
2015/11/24 11:55:14.102144 single.go:150: INFO backoff retry: 2s
2015/11/24 11:55:16.103318 single.go:121: INFO Connecting error publishing events (retrying): not connected
2015/11/24 11:55:16.103341 single.go:143: INFO send fail
2015/11/24 11:55:16.103350 single.go:150: INFO backoff retry: 4s
2015/11/24 11:55:16.348388 prospector.go:185: DBG  Start next scan
2015/11/24 11:55:16.348459 prospector.go:206: DBG  scan path /var/log/auth.log
2015/11/24 11:55:16.348507 prospector.go:218: DBG  Check file for harvesting: /var/log/auth.log
2015/11/24 11:55:16.348533 prospector.go:336: DBG  Update existing file for harvesting: /var/log/auth.log
2015/11/24 11:55:16.348552 prospector.go:378: DBG  Not harvesting, file didn't change: /var/log/auth.log
2015/11/24 11:55:20.104799 single.go:121: INFO Connecting error publishing events (retrying): not connected
```

TCP dump capture

```
abonuccelli@w530 /opt/elk/PRODSEC/beats/filebeat/filebeat-1.0.0-rc2-x86_64 $ sudo tcpdump -i any dst port 9202 -vvAn
tcpdump: listening on any, link-type LINUX_SLL (Linux cooked), capture size 65535 bytes



12:40:13.163579 IP (tos 0x0, ttl 64, id 47381, offset 0, flags [DF], proto TCP (6), length 185)
    192.168.1.105.41657 > 192.168.1.105.9202: Flags [P.], cksum 0x84ce (incorrect -> 0x460f), seq 666195377:666195510, ack 2992500535, win 3102, options [nop,nop,TS val 235205216 ecr 235204215], length 133
E.....@.@......i...i..#.'.U..].7...........
..W....K.......N.."... c...x..n..l.s....d.f6,Yu/&.G.^..l'P2.A...(..@J.<Z!......x^.?[...v.
12:40:13.164354 IP (tos 0x0, ttl 64, id 47382, offset 0, flags [DF], proto TCP (6), length 52)
    192.168.1.105.41657 > 192.168.1.105.9202: Flags [.], cksum 0x8449 (incorrect -> 0xfed0), seq 133, ack 182, win 3102, options [nop,nop,TS val 235205216 ecr 235205216], length 0
E..4..@.@......i...i..#.'.V6.].......I.....
...`...`
12:40:13.164651 IP (tos 0x0, ttl 64, id 47383, offset 0, flags [DF], proto TCP (6), length 185)
    192.168.1.105.41657 > 192.168.1.105.9202: Flags [P.], cksum 0x84ce (incorrect -> 0xa67d), seq 133:266, ack 182, win 3102, options [nop,nop,TS val 235205216 ecr 235205216], length 133
E.....@.@......i...i..#.'.V6.].............
...`...`.......Q.""...C..}M.j.MU+....=*.'14.P.ba"..2.....Wc[....u... @.u>..+,sx...ot........s ..b....I..m..!..R.........w.%!.1G37a..q/k8M...!
12:40:13.202965 IP (tos 0x0, ttl 64, id 47384, offset 0, flags [DF], proto TCP (6), length 52)
    192.168.1.105.41657 > 192.168.1.105.9202: Flags [.], cksum 0x8449 (incorrect -> 0xfd8c), seq 266, ack 363, win 3102, options [nop,nop,TS val 235205226 ecr 235205216], length 0
E..4..@.@......i...i..#.'.V..].......I.....
...j...`
12:40:14.165462 IP (tos 0x0, ttl 64, id 47385, offset 0, flags [DF], proto TCP (6), length 185)
    192.168.1.105.41657 > 192.168.1.105.9202: Flags [P.], cksum 0x84ce (incorrect -> 0x4ba1), seq 266:399, ack 363, win 3102, options [nop,nop,TS val 235205466 ecr 235205216], length 133
E.....@.@......i...i..#.'.V..].............
s1].T....r..r....#.(.....,....\&<V.Bm.^.....l...R...;.>..f...E9.m1..ce...Kb...?..vs.!.....?..c..{../.J$.C.@....#..M}m.....;x
12:40:14.165847 IP (tos 0x0, ttl 64, id 47386, offset 0, flags [DF], proto TCP (6), length 52)
    192.168.1.105.41657 > 192.168.1.105.9202: Flags [.], cksum 0x8449 (incorrect -> 0xfa68), seq 399, ack 544, win 3102, options [nop,nop,TS val 235205466 ecr 235205466], length 0
E..4..@.@......i...i..#.'.W@.].V.....I.....
...Z...Z
```

No relveant logs identified in Elasticsearch in DEBUG

**Comment by urso** [comment]
Thanks for you help on this issue.
